"Maisonette for sale, 3 bedrooms, Loopealse põik 9, Sõrve, Harku vald, Harjumaa - Real estate portal KV.EE ","Apartment ownership, wooden house, total area 187.3 m²",https://www.kv.ee/muua-turvalises-ja-rahulikus-sorve-kulas-hubane-ma-3355162.html,"59.4305496,24.4419188",5,3,187.3 m²,2,2006,Good condition,apartment ownership,,Notify about incorrect advertisement,"parquet, parking free parking, public transport, deep well, TV-set, terrace, electricity, furniture, packet windows","shower, toilet room and bathroom separate, sauna, bath, water boiler, washing machine","solid fuel, heated floors, fireplace",Internet,"surrounding buildings private houses, roads in good condition roads, neighbours next to neighbours, near forest",Data from realestate book,"electric stove, refridgerator, kitchen furniture",ready,9782002,Missing,,,,
"Maisonette for sale, 3 bedrooms, Timuti 32, Variku, Tartu linn, Tartu, Tartumaa - Real estate portal KV.EE ",Total area 190 m²,https://www.kv.ee/muua-heas-seisukorras-majaosa-vaikses-variku-linna-3300697.html,"58.3477081,26.7021519",5,3,190 m²,2,1964,ready,,895 m²,Notify about incorrect advertisement,"balcony , roof asbestos cement roof",,"stove heating, õhksoojuspump, fireplace",,,,,,,,79509:015:0004,,,
"Maisonette for sale, 3 bedrooms, Rattasepa tee, Soinaste, Kambja vald, Tartumaa - Real estate portal KV.EE ","Private ownership, stone house, total area 117.4 m²",https://www.kv.ee/kivimaja-kogupind-117-4-m2lisainfo-uhistransport-p-3386192.html,"58.3401012,26.6987658",4,3,117.4 m²,1,2015,all brand-new,private property,,Notify about incorrect advertisement,"electricity, dressing room, parquet, packet windows, parking free parking, public transport, TV-set, terrace, roof profiled roof","shower, water boiler, toilet room and bathroom separate, sauna, bath, urban water, sewerage","heated floors, gas","Internet, cable TV, fenced with garden, steel door","location in suburb location, roads in good condition roads, neighbours around neighbours, surrounding buildings private houses",Data from realestate book,,ready,,C,,,,
"Row house box for sale, 3 bedrooms, Vabaõhumuuseumi tee 77a, Haabersti, Tallinn, Harjumaa - Real estate portal KV.EE ","Apartment ownership, stone house, house area 95.1 m², total area 97.1 m²",https://www.kv.ee/tutvustame-teile-ridamaja-nurgapoolset-majaosa-nr-3314224.html,"59.4456053,24.609696",4,3,97.1 m²,2,2022,all brand-new,apartment ownership,96 m²,Notify about incorrect advertisement,"parking not free parking, TV-set, terrace, electricity, dressing room, packet windows, parquet, public transport, box-room","shower, sauna, bath, toilet room and bathroom separate, urban water, sewerage","heated floors, õhksoojuspump","Internet, phone, cable TV","near forest, roads in good condition roads, neighbours at one side neighbours, Tallinna laht sea 600 m, surrounding buildings private houses and apartment buildings, location in suburb location",Data from realestate book,,,,,,,,
"Maisonette for sale, 3 bedrooms, Keraheina tee 13, Maardu, Harjumaa - Real estate portal KV.EE ","Apartment ownership, stone house, house area 110 m², total area 120 m²",https://www.kv.ee/paarismajad-valmivad-2022-aasta-jouludeks-kokku-ke-3392767.html,"59.4696363,24.9541781",4,3,120 m²,2,2022,all brand-new,apartment ownership,600 m²,Notify about incorrect advertisement,,,,,,Data from realestate book,,,,,,,,
"Maisonette for sale, 5 bedrooms, Aardla 156/3, Ränilinn, Tartu linn, Tartu, Tartumaa - Real estate portal KV.EE ","Private ownership, stone house, total area 216 m²",https://www.kv.ee/heas-korras-suur-kodu-tupiktanava-lopus-kinnisvara-3385140.html,"58.35159,26.679976",6,5,216 m²,3,1995,renovated,private property,298 m²,Notify about incorrect advertisement,"balcony , open kitchen, water, parquet, street entrance, public transport, wall cupboard, new electricity, organisation through the few floors, separate entryway, closed courtyard, separate rooms, parking free parking, electricity, dressing room, basement, garage, roof tiled roof","shower, water boiler, sauna, toilet room and bathroom separate, washing machine, sewerage, urban water","central heating, fireplace, gas","Internet, phone, cable TV, fenced with garden","in the city location, surrounding buildings apartment buildings",,"ceramic shove, refridgerator, kitchen furniture",,,,,,,
"Maisonette for sale, 3 bedrooms, Metsarahva tee 19, Metsakasti, Viimsi vald, Harjumaa - Real estate portal KV.EE ","Stone house, total area 116.6 m²",https://www.kv.ee/kasutusluba-on-olemas-muua-sisustatud-rodu-terrass-3382681.html,"59.495317,24.9011961",4,3,116.6 m²,2,,,,,Notify about incorrect advertisement,"new sewerage, balcony , kitchen, open kitchen, public transport, box-room, wall cupboard, separate rooms, new electricity, closed courtyard, electricity, furniture, parquet, dressing room","shower, sauna, toilet room and bathroom separate, bath","heated floors, fireplace","Internet, fenced with garden, steel door",near forest,Data from realestate book,electric stove,,,Missing,,,,
"Maisonette for sale, 2 bedrooms, Põllu tee, Pärnamäe, Viimsi vald, Harjumaa - Real estate portal KV.EE ","Apartment ownership, stone house, total area 78.8 m²",https://www.kv.ee/muua-heas-korras-avar-3toaline-korter-6korteriga-g-3322955.html,,3,2,78.8 m²,,2005,Good condition,apartment ownership,,Notify about incorrect advertisement,,"bath, shower, urban water, sewerage, washing machine","heated floors, gas heating","steel door, security system","near forest, roads in good condition roads",Data from realestate book,"electric stove, refridgerator, kitchen furniture",ready,,,,1/2,,"wall cupboard, terrace, packet windows, parquet, public transport, box-room"
"Maisonette for sale, Maarjamõisa tee 31, Aravete, Järva vald, Järvamaa - Real estate portal KV.EE ","Private ownership, stone house, house area 250.1 m², total area 382.4 m²",https://www.kv.ee/aravete-alevikus-muua-4-korteriga-elamu-osa-majas-3363743.html,"59.133408,25.7462982",10,,382.4 m²,2,,sanitary renovation needed,private property,882 m²,Notify about incorrect advertisement,,"shower, water boiler, urban water, sewerage","solid fuel, central heating",,"roads in satisfactory condition roads, neighbours around neighbours, near forest",,electric stove,ready,,,13402:004:1640,,,"balcony 4 m², furnishing possibility, furniture, packet windows, parking free parking, public transport, farm building, electricity"
"Maisonette for sale, 3 bedrooms, Kloogaranna tee  12, Laulasmaa, Lääne-Harju vald, Harjumaa - Real estate portal KV.EE ",Total area 128.5 m²,https://www.kv.ee/muua-4toalised-paarismajad-laulasmaal-kloogaranna-3337486.html,"59.37435765,24.2437688",4,3,128.5 m²,2,2020,all brand-new,,1540 m²,Notify about incorrect advertisement,,,,,,Data from realestate book,,ready,,,,,,
"Maisonette for sale, 3 bedrooms, JUURE TEE 2, Tiskre, Harku vald, Harjumaa - Real estate portal KV.EE ","Apartment ownership, stone house, house area 95.3 m², total area 113.2 m²",https://www.kv.ee/uus-galleriimajakorterid-tiskre-kulas-valmimisaeg-3292477.html,"59.4237628,24.5826002",4,3,113.2 m²,,2021,all brand-new,apartment ownership,,Notify about incorrect advertisement,"parking free parking, public transport, box-room, terrace, electricity, packet windows, parquet, wall ceramisite wall","toilet room and bathroom separate, bath, urban water, sewerage","õhksoojuspump, heated floors, combined heating, gas",,"Harku järv lake 600 m, surrounding buildings private houses and apartment buildings, location in suburb location, roads in good condition roads",Data from realestate book,electric stove,foundation,,B,,2/2,,
"Row house box for sale, 3 bedrooms, Kesk-Vaela 20, Vaela, Kiili vald, Harjumaa - Real estate portal KV.EE ","Apartment ownership, stone house, house area 93.6 m², total area 105.6 m²",https://www.kv.ee/arenduseleht-httpskiili-wingmacht-eemaja-luhikirje-3384151.html,"59.3274921,24.7989023",4,3,105.6 m²,1,2022,all brand-new,apartment ownership,,Notify about incorrect advertisement,"parquet, dressing room, packet windows","shower, sauna, urban water, sewerage",,,,Data from realestate book,,,,,30501:001:0258,,,
"Maisonette for sale, 4 bedrooms, Rohuneeme tee 144, Rohuneeme, Viimsi vald, Harjumaa - Real estate portal KV.EE ","Apartment ownership, stone house, total area 155 m²",https://www.kv.ee/muua-valmimisjargus-rohuneeme-villad-paarismaja-bo-3388211.html,"59.559109,24.7984147",5,4,155 m²,2,2022,all brand-new,apartment ownership,,Notify about incorrect advertisement,"parquet, packet windows","bath, sauna","heated floors, geothermic heating",,"water body sea near, near forest",,,,,,89001:003:0718,,,
"Row house box for sale, 3 bedrooms, Pargi tee 2, Haaslava, Kastre vald, Tartumaa - Real estate portal KV.EE ","Apartment ownership, stone house, house area 97.2 m², total area 114.5 m²",https://www.kv.ee/tartu-kulje-all-haaslava-kulas-aadressil-pargi-tee-3380490.html,"58.3256658,26.7934275",4,3,114.5 m²,2,2022,all brand-new,apartment ownership,2814 m²,Notify about incorrect advertisement,"parking free parking, terrace, electricity, dressing room, packet windows, parquet, public transport, box-room","toilet room and bathroom separate, shower, bath, sauna, urban water, sewerage","heated floors, geothermic heating","Internet, steel door, neighbourhood watch, fenced with garden","roads in good condition roads, near forest",Data from realestate book,,,,A,,,,
"Row house box for sale, 3 bedrooms, Kesk-Vaela 27, Vaela, Kiili vald, Harjumaa - Real estate portal KV.EE ","Apartment ownership, stone house, house area 91.9 m², total area 103.9 m²",https://www.kv.ee/arenduseleht-httpskiili-wingmacht-eemaja-luhikirje-3384153.html,"59.3274921,24.7989023",4,3,103.9 m²,1,2022,all brand-new,apartment ownership,,Notify about incorrect advertisement,"parquet, dressing room, packet windows","shower, sauna, urban water, sewerage",,,,Data from realestate book,,,,,30501:001:0262,,,
"Maisonette for sale, 4 bedrooms, Nõgikikka 12, Haabersti, Tallinn, Harjumaa - Real estate portal KV.EE ","Apartment ownership, stone house, total area 143.7 m²",https://www.kv.ee/eelregistreerumine-tutvuma-5-detsember-kell-15-ann-3389969.html,"59.434077,24.6169387",5,4,143.7 m²,2,2007,ready,apartment ownership,669 m²,Notify about incorrect advertisement,"balcony 10 m², balcony , open kitchen, organisation through the few floors, closed courtyard, separate rooms, public transport, wall cupboard, parking free parking, parquet, garage, dressing room, terrace, roof tar paper roof","bath, sauna, shower, sewerage, urban water","heated floors, heated floors, gas heating","Internet, cable TV, neighbourhood watch, steel door, fenced with garden","water body sea near, surrounding buildings private houses, location in suburb location",,"ceramic shove, refridgerator, kitchen furniture",,,,,,,
"Maisonette for sale, Nurme 30, Raadi-Kruusamäe, Tartu linn, Tartu, Tartumaa - Real estate portal KV.EE ","Joint ownership, stone house, total area 74.7 m²",https://www.kv.ee/rohkete-voimalustega-kodu-kinnisvaraturu-avalike-p-3379730.html,"58.3987,26.723015",3,,74.7 m²,2,1977,sanitary renovation needed,joint ownership,549 m²,,"separate rooms, water, separate entryway, street entrance, public transport, farm building, high ceilings, parking free parking, closed courtyard, electricity","water boiler, shower, toilet room and bathroom separate, bath, sewerage, urban water",stove heating,"Internet, phone, cable TV, fenced with garden","water body river near, in the city location, surrounding buildings private houses",,"electric stove, kitchen furniture",,,,79512:048:0025,,,
"Row house box for sale, 3 bedrooms, Kauri tee 8/2, Alliku, Saue vald, Harjumaa - Real estate portal KV.EE ","Apartment ownership, wooden house, total area 129 m²",https://www.kv.ee/broneeritud-saue-vallas-veskimoldre-elurajoonis-ka-3387920.html,"59.362790333927,24.58763019259",4,3,129 m²,2,2007,renovated,apartment ownership,650 m²,Notify about incorrect advertisement,"new sewerage, balcony , kitchen, open kitchen, furniture, parquet, dressing room, garage, box-room, separate rooms, separate entryway, organisation through the few floors, new electricity, closed courtyard, public transport, electricity, furnishing possibility, roof tar paper roof","toilet room and bathroom separate, water boiler, sauna, shower, urban water","gas heating, gas","Internet, fenced with garden, neighbourhood watch, steel door",,Data from realestate book,"ceramic shove, refridgerator",,,,,,,
"Maisonette for sale, 3 bedrooms, Toomhansu 8, Kiili, Kiili vald, Harjumaa - Real estate portal KV.EE ","Apartment ownership, stone house, total area 120 m²",https://www.kv.ee/kiili-kodukvartali-uusarendus-inspireerivad-ja-hin-3381569.html,"59.3097965,24.8367254",5,3,120 m²,,2022,all brand-new,apartment ownership,3251 m²,Notify about incorrect advertisement,"ventilation, parquet, lift, parking free parking",,,,roads paved roads,Data from realestate book,,,,,,1/2,,
"Row house box for sale, 4 bedrooms, Lõvisaba tee 8, Papsaare, Pärnu, Pärnumaa - Real estate portal KV.EE ","Apartment ownership, wooden house, total area 124 m²",https://www.kv.ee/lovisaba-tee-kaksikelamud-asuvad-parnu-kesklinnast-3378984.html,"58.410487,24.3846736",5,4,124 m²,,2022,all brand-new,apartment ownership,,Notify about incorrect advertisement,"parking free parking, wall cupboard, terrace, electricity, dressing room, packet windows, parquet, public transport, box-room","shower, bath, urban water, sewerage","heated floors, õhksoojuspump","Internet, phone, cable TV","near forest, roads in good condition roads, neighbours around neighbours, Audru river 1.4 km, surrounding buildings private houses, location in suburb location",Data from realestate book,,ready,3139606,B,,1/2,,
"Maisonette for sale, Sarapuu 14, Annelinn, Tartu linn, Tartu, Tartumaa - Real estate portal KV.EE ","Wooden house, house area 100.3 m², total area 111 m²",https://www.kv.ee/tartumaa-tartu-tartu-linn-annelinn-sarapuu-14-5-tu-3366001.html,"58.377891,26.7588551",5,,111 m²,2,1977,Good condition,,309 m²,Notify about incorrect advertisement,"parking free parking, basement, electricity, 3*380V, packet windows, parquet, garage, public transport, farm building, box-room","sauna, toilet room and bathroom separate, shower, bath, urban water","stove heating, solid fuel","neighbourhood watch, steel door, fenced with garden","neighbours next to neighbours, in the city location, surrounding buildings private houses and apartment buildings, roads in good condition roads",,"ceramic shove, kitchen furniture",ready,,,79516:016:0006,,,
"Maisonette for sale, 4 bedrooms, Otsa tn 12, Liikva, Harku vald, Harjumaa - Real estate portal KV.EE ","Stone house, house area 165 m², total area 170 m²",https://www.kv.ee/muua-renoveeritud-5toaline-maakuttega-paarismaja-o-3378799.html,"59.4211285,24.4255029",5,4,170 m²,2,2007,renovated,,3276 m²,Notify about incorrect advertisement,"public transport, farm building, terrace, electricity, parquet, packet windows, roof profiled roof","sauna, shower, sewerage, urban water","heated floors, geothermic heating",,"near forest, surrounding buildings private houses, roads in good condition roads, neighbours around neighbours",Data from realestate book,kitchen furniture,ready,,-,,,,
"Row house box for sale, 3 bedrooms, Iirise tn 8, Tartu linn, Tartu, Tartumaa - Real estate portal KV.EE ","Apartment ownership, stone house, total area 97.9 m²",https://www.kv.ee/muua-eksklusiivses-rohelusest-umbritsetud-ihaste-k-3391380.html,"58.355921,26.766155",4,3,97.9 m²,2,2022,all brand-new,apartment ownership,,Notify about incorrect advertisement,"open kitchen, street entrance, terrace, dressing room, separate rooms, packet windows, parquet, parking free parking, public transport, box-room, organisation through the few floors, separate entryway, closed courtyard","toilet room and bathroom separate, sauna, shower, sewerage, urban water","heated floors, geothermic heating","Internet, phone, cable TV, steel door, fenced with garden",,,,,,,79301:001:0985,,,
"Row house box for sale, 4 bedrooms, Vanatoa tee 5, Lähtse, Kiili vald, Harjumaa - Real estate portal KV.EE ","Wooden house, total area 100.4 m²",https://www.kv.ee/rabarebase-aedlinn-on-terviklik-elukeskkond-kuhu-o-3381214.html,"59.292014,24.863741",5,4,100.4 m²,,2022,all brand-new,,245 m²,Notify about incorrect advertisement,"open kitchen, ventilation, water, box-room, roof tar paper roof","shower, bath, sauna, toilet room and bathroom separate, urban water, sewerage",geothermic heating,"steel door, neighbourhood watch",,,electric stove,,,,30501:001:0170,2/2,,
"Maisonette for sale, 3 bedrooms, Keskuse tee 9/2, Vahi alevik, Tartu vald, Tartumaa - Real estate portal KV.EE ","Apartment ownership, stone house, total area 111.9 m²",https://www.kv.ee/muugile-on-joudnud-maakuttega-a-energiatohususe-kl-3377207.html,"58.407848,26.7456725",4,3,111.9 m²,2,2022,all brand-new,apartment ownership,,,"new sewerage, open kitchen, ventilation, new electricity, parking free parking, closed courtyard, public transport, electricity, parquet, dressing room, box-room, separate rooms, street entrance, separate entryway, organisation through the few floors","sauna, shower, bath, toilet room and bathroom separate, urban water","heated floors, geothermic heating","Internet, steel door, fenced with garden",near forest,,kitchen 8.8 m²,,,A,,,,
"Maisonette for sale, Lucca park 2, Tiskre, Harku vald, Harjumaa - Real estate portal KV.EE ",Total area 355.4 m²,https://www.kv.ee/paarismaja-osa-harku-vallas-tabasalus-asuvas-vanas-3361433.html,"59.4352375,24.54557846875",,,355.4 m²,3,2002,all brand-new,,1723 m²,,,,,,,Data from realestate book,,ready,,Missing,,,,
"Row house box for sale, 3 bedrooms, Juure tee 5, Tiskre, Harku vald, Harjumaa - Real estate portal KV.EE ","Apartment ownership, stone house, total area 102.3 m²",https://www.kv.ee/harku-vallas-tiskre-kulas-on-ehitamisel-uued-aener-3356776.html,"59.4246858,24.5829683",4,3,102.3 m²,2,2022,all brand-new,apartment ownership,107 m²,Notify about incorrect advertisement,"parking free parking, box-room, roof tar paper roof",,geothermic heating,,water body lake near,Data from realestate book,electric stove,,,,,,,
"Row house box for sale, 3 bedrooms, Iirise tn 8, Tartu linn, Tartu, Tartumaa - Real estate portal KV.EE ","Apartment ownership, stone house, total area 98.1 m²",https://www.kv.ee/muua-eksklusiivses-rohelusest-umbritsetud-ihaste-k-3375114.html,"58.355921,26.766155",4,3,98.1 m²,2,2022,all brand-new,apartment ownership,,Notify about incorrect advertisement,"open kitchen, street entrance, terrace, dressing room, separate rooms, packet windows, parquet, parking free parking, public transport, box-room, organisation through the few floors, separate entryway, closed courtyard","toilet room and bathroom separate, sauna, shower, sewerage, urban water","heated floors, geothermic heating","Internet, phone, cable TV, steel door, fenced with garden",,,,,,,79301:001:0985,,,
"Maisonette for sale, 3 bedrooms, Soovõha tee 2, Pirita, Tallinn, Harjumaa - Real estate portal KV.EE ","Apartment ownership, stone house, total area 174.4 m²",https://www.kv.ee/muua-paarismaja-boks-pirital-mannimetsa-laheduses-3357453.html,"59.4856749,24.8580144",4,3,174.4 m²,2,2014,all brand-new,apartment ownership,1293 m²,Notify about incorrect advertisement,"new sewerage, balcony , kitchen, open kitchen, parquet, dressing room, ventilation, parking free parking, box-room, wall cupboard, separate rooms, separate entryway, organisation through the few floors, new electricity, high ceilings, closed courtyard, public transport, electricity, roof tar paper roof","toilet room and bathroom separate, bath, sauna, shower, urban water","gas heating, gas, fireplace","Internet, cable TV, fenced with garden, neighbourhood watch, security system, steel door",near forest,Data from realestate book,ceramic shove,,,,,,,
"Maisonette for sale, 4 bedrooms, Hundi tee 11/1, Haabneeme, Viimsi vald, Harjumaa - Real estate portal KV.EE ","Stone house, total area 131.7 m²",https://www.kv.ee/muua-ridaelamu-boks-viimsi-sudames-haabneeme-alevi-3390223.html,"59.5189309,24.8281231",5,4,131.7 m²,2,2016,Good condition,,6687 m²,Notify about incorrect advertisement,"terrace, electricity, dressing room, furnishing possibility, furniture, parking free parking, box-room, wall cupboard, TV-set","bath, shower, toilet room and bathroom separate, sewerage, washing machine",gas heating,"Internet, fenced with garden","water body sea 1,000 m",Data from realestate book,"electric stove, refridgerator, kitchen furniture",ready,,,,,,
"Maisonette for sale, 3 bedrooms, Keskuse tee 9/2, Vahi alevik, Tartu vald, Tartumaa - Real estate portal KV.EE ","Apartment ownership, stone house, total area 109.9 m²",https://www.kv.ee/muugile-on-joudnud-maakuttega-a-energiatohususe-kl-3376598.html,"58.407848,26.7456725",4,3,109.9 m²,2,2021,all brand-new,apartment ownership,,,"new sewerage, open kitchen, public transport, electricity, parquet, dressing room, ventilation, parking free parking, box-room, street entrance, separate rooms, separate entryway, organisation through the few floors, new electricity","toilet room and bathroom separate, bath, shower, sauna, urban water","heated floors, geothermic heating","Internet, fenced with garden, steel door",,,,,,A,,,,
"Maisonette for sale, 4 bedrooms, Rohuneeme tee 144, Rohuneeme, Viimsi vald, Harjumaa - Real estate portal KV.EE ","Apartment ownership, stone house, total area 155 m²",https://www.kv.ee/muua-valmimisjargus-urban-villad-paarismaja-boksid-3300441.html,"59.4852058,24.8438487",5,4,155 m²,2,2022,all brand-new,apartment ownership,,Notify about incorrect advertisement,"parquet, packet windows","bath, sauna","heated floors, geothermic heating",,"water body sea near, near forest",,,,,,89001:003:0718,,,
"Maisonette for sale, 4 bedrooms, Ristiku 31, Variku, Tartu linn, Tartu, Tartumaa - Real estate portal KV.EE ","Apartment ownership, stone house, total area 129 m²",https://www.kv.ee/uuenduskolmapaeval-24-novembril-toimus-2-korruse-l-3389594.html,"58.3493122,26.7093069",5,4,129 m²,2,2022,all brand-new,apartment ownership,1146 m²,Notify about incorrect advertisement,"balcony , parking free parking, box-room",,õhksoojuspump,,,Data from realestate book,kitchen 7.3 m²,,,,,,,
"Maisonette for sale, 2 bedrooms, Jaama, Jõgeva linn, Jõgeva vald, Jõgevamaa - Real estate portal KV.EE ","Joint ownership, log house, house area 81 m², total area 90.4 m²",https://www.kv.ee/jogeva-kesklinna-lahedal-muua-12-kaasomand-hoonest-3389972.html,,3,2,90.4 m²,2,1905,needs renovating,joint ownership,1000 m²,Notify about incorrect advertisement,"electricity, furniture, farm building, well","shower, sauna, water boiler, washing machine, local water, sewerage, urban water",stove heating,,"neighbours around neighbours, location in the center location, roads paved roads, Pedja river 700 m",,stove heated with firewood,,,,,,,
"Maisonette for sale, 2 bedrooms, E. Enno tn 6, Valga linn, Valga vald, Valgamaa - Real estate portal KV.EE ","Joint ownership, log house, total area 73 m²",https://www.kv.ee/muua-pool-majast-eluruumi-pind-pohikorrusel-ca-53-3227506.html,"57.775742,26.046003",2,2,73 m²,2,1963,needs renovating,joint ownership,368 m²,Notify about incorrect advertisement,"open kitchen, electricity, water, ventilation","shower, urban water, sewerage",solid fuel,"Internet, steel door",,Data from realestate book,"electric stove, kitchen furniture",,,Missing,,,,
"Maisonette for sale, Palkoja 11, Muraste, Harku vald, Harjumaa - Real estate portal KV.EE ","Apartment ownership, stone house, total area 134.9 m²",https://www.kv.ee/tallinna-kulje-all-muraste-kulas-aadressil-palkoja-3377290.html,"59.4504833,24.4433876",4,,134.9 m²,2,2022,all brand-new,apartment ownership,1358 m²,,"balcony , public transport, box-room, separate entryway, closed courtyard, ventilation, roof tin roof","shower, sauna, toilet room and bathroom separate, bath, urban water",heated floors,"Internet, fenced with garden, steel door",near forest,,,,,A,,,,
"Maisonette for sale, 3 bedrooms, Allikalohu 2, Harku, Harku vald, Harjumaa - Real estate portal KV.EE ","Stone house, total area 153.3 m²",https://www.kv.ee/majade-ehitus-kaib-ja-eramud-saavad-valmis-juba-jo-3382659.html,"59.3880078287023,24.5332545873406",4,3,153.3 m²,,2021,all brand-new,,2413 m²,Notify about incorrect advertisement,"parking free parking, terrace, electricity, dressing room, 3*380V, packet windows, parquet, public transport, box-room, wall cupboard, TV-set","sauna, shower, water boiler, urban water, sewerage","heated floors, õhksoojuspump",Internet,"near forest, surrounding buildings private houses, location outside settlement location, roads in good condition roads, neighbours at one side neighbours, Vääna river 500 m",,,,,,72501:001:0161,1/1,,
"Row house box for sale, 3 bedrooms, Kesk-Vaela 29, Vaela, Kiili vald, Harjumaa - Real estate portal KV.EE ","Apartment ownership, stone house, house area 91.9 m², total area 103.9 m²",https://www.kv.ee/arenduseleht-httpskiili-wingmacht-eemaja-luhikirje-3384155.html,"59.3268498,24.7988004",4,3,103.9 m²,1,2022,all brand-new,apartment ownership,,Notify about incorrect advertisement,"parquet, dressing room, packet windows","shower, sauna, urban water, sewerage",,,,Data from realestate book,,,,,30501:001:0264,,,
